<?xml version="1.0" encoding="UTF-8"?>
<!-- <!DOCTYPE circuit SYSTEM "circuit.dtd"> -->
<circuit ver="1.0">

<component><!-- jelgenerator -->
 <id>0</id>
 <type>signalgenerator</type>
 <value>1010</value>
</component>

<component><!-- oszcilloszkop-->
 <id>1</id>
 <type>scope</type>
</component>

<component><!-- vezetek a jelgenerator kimenete es az oszcilloszkop bemenete kozott -->
 <id>2</id>
 <type>wire</type>
 <connections>
  <in>
   <id>0</id>
   <pin>0</pin>
  </in>
  <out>
   <id>1</id>
   <pin>0</pin>
  </out>
 </connections>
</component>

</circuit>